DOI,PMID,arXiv ID,Title,Abstract,Authors,Journal,Year
10.1155/2022/9916292,,,Sim-to-Real Reinforcement Learning for Autonomous Driving Using Pseudosegmentation Labeling and Dynamic Calibration,"Applying reinforcement learning algorithms to autonomous driving is difficult because of mismatches between the simulation in which the algorithm was trained and the real world. To address this problem, data from global navigation satellite systems and inertial navigation systems (GNSS/INS) were used to gather pseudolabels for semantic segmentation. A very simple dynamics model was used as a simulator, and dynamic parameters were obtained from the linear regression of manual driving records. Segmentation and a dynamic calibration method were found to be effective in easing the transition from a simulation to the real world. Pseudosegmentation labels are found to be more suitable for reinforcement learning models. We conducted tests on the efficacy of our proposed method, and a vehicle using the proposed system successfully drove on an unpaved track for approximately 1.8 km at an average speed of 26.57 km/h without incident.","Jiseong Heo,Hyoung woo Lim",Journal of Robotics,2022
10.1155/2022/3873639,,,Computational Validation of the Best Tuning Method for a Vehicle-Integrated PID Controller,"This paper validates and analyzes the robustness of the proportional-integral-derivative (PID) action controller from an open transfer function that integrates a proportional-integral (PI) action controller to obtain the response of a robust action control during the automatic parking maneuver of a vehicle where the simulations are based on 3 adjustment methods: Ziegler-Nichols (ZN), Chien-Hrones-Reswick (CHR), and Cohen-Coon (CC), and as a result of the computer simulations, it is determined the best performance index of the PID controller represented by mathematical and graphic equations with the help of MATLAB/Simulink software.","Calequela J. T. Manuel,Max M. D. Santos,G. Lenzi,A. Tusset",Modelling and Simulation in Engineering,2022
10.1155/2022/9374118,,,Active Lane-Changing Control of Intelligent Vehicle on Curved Section of Expressway,"In order to improve the intelligent vehicle lane-changing performance, an active lane-changing control algorithm is proposed considering the changes of road curvature and vehicle speed. Firstly, the vehicle dynamics model considering vehicle speed variation and lane-changing safety distance is established, and the expected lane-changing trajectory model under the curved road is designed simultaneously. Then, taking the yaw rate and longitudinal speed as the control objectives of lateral and longitudinal motions, respectively, the sliding-mode variable structure control method based on Lyapunov stability condition is adopted, and the trajectory tracking controller is designed by combining the inverted method to track the desired lane-changing trajectory. Finally, the lane-changing trajectory model and trajectory tracking controller are verified in simulation platform of CarSim/Simulink and hardware-in-the-loop (HIL) test bench. The results show that the proposed trajectory tracking control method can perform the lane-changing behavior well under different road curvatures and vehicle speeds while maintaining high trajectory tracking control accuracy.","Pengfei Feng,Huiqing Jin,Linfeng Zhao,Mingyu Lu",Modelling and Simulation in Engineering,2022
10.1155/2022/8348726,,,Modeling and Simulation of Traffic Congestion for Mixed Traffic Flow with Connected Automated Vehicles: A Cell Transmission Model Approach,"Connected automated vehicles (CAVs) can significantly shorten the headway of car following, thereby effectively improving the traffic capacity and injecting new power to alleviate traffic congestion. To investigate the congestion characteristics of mixed traffic flow with CAVs and human-driven vehicles (HDVs), this paper proposes a cell transmission model to capture and simulate traffic congestion for mixed traffic flow. Firstly, the Newell, adaptive cruise control (ACC), and cooperative adaptive cruise control (CACC) models are adopted to capture the car-following behavior of different vehicles. Secondly, the fundamental diagram under different penetration rates of CAVs is derived based on car-following models. Then, the cell transmission model (CTM) of mixed traffic flow is developed based on the classical CTM and fundamental diagram of mixed traffic flow. Finally, two simulation methods, mixed traffic flow CTM and micro-simulation, are designed to verify the effectiveness of the proposed model. Moreover, taking the moving bottleneck on the expressway as an example, the congestion characteristics of mixed traffic flow are analyzed using multiple indexes, such as average travel speed, congestion delay, and congestion scale. The results show the following: (i) CAVs can significantly alleviate traffic congestion, (ii) the duration of the bottleneck is positively correlated with the degree of traffic congestion, and (iii) The traffic congestion assessment results under different model parameters slightly differ, but the impact is negligible.","Yunxia Wu,Yalan Lin,R. Hu,Zilan Wang,Bin Zhao,Zhihong Yao",Journal of Advanced Transportation,2022
10.1109/tim.2022.3158998,,,V2I-CARLA: A novel dataset and a method for vehicle re-Identification based V2I environment,"V2I is the current development trend for modern day intelligent transportation systems, and corresponds to an emerging topic in the field of automatic driving. In perceptual task of road vehicle collaboration, vehicle cross-camera matching plays a key role in achieving automatic driving vehicles overview blind zone perception. Existing re-identification methods for vehicles cross-camera matching ignore the vehicle detailed characteristics. Considering the shortage of vision distance and a single perspective overlapping problem from the existing datasets, this paper builds a vehicle re-identification data set V2I-Carla based on an automatic driving simulator, thereby matching the same vehicle successfully when the common feature is few at different perspectives. For the re-identification task, this paper proposes a method for vehicle re-identification by introducing a pyramid method, which tends to obtain multi-scale features of the vehicle under different cameras, capturing subtle features difference between the vehicles with similar appearance. Simultaneously, circle loss is used in this work for network optimization, and the network is more distinguished. We evaluated our method on V2I-Carla data-set and Veri776 dataset. The experimental results show the superiority of our method, which renders significant improvement over the baseline on different datasets.The dataset V2I-CARLA is available at the https://github.com/Yx1322441675/V2I-CARLA.","Hai Wang,Xin Yuan,Yingfeng Cai,Long Chen,Yicheng Li",IEEE Transactions on Instrumentation and Measurement,2022
10.1109/mvt.2017.2787272,,,The Future of Vehicular Security and Privacy [From the Guest Editors],"This special issue of IEEE Vehicular Technology Magazine presents the latest findings and perspectives on the emerging and important area of vehicular security and privacy. Five articles form this special issue, all of which introduce a breadth of new solutions that will help the community combat the growing threat of vehicular cyberattacks. These solutions include cryptographic methods, blockchain, and new architectural considerations for CAN to protect these transportation systems both from a wireless perspective as well as from inside the vehicle itself.","Alexander M. Wyglinski,James Irvine,Joseph Chapman",IEEE Vehicular Technology Magazine,2018
10.1109/mvt.2017.2647814,,,Securing Vehicular Controller Area Networks: An Approach to Active Bus-Level Countermeasures,"With the increasing number of embedded processors and wireless interfaces being incorporated into modern automobiles, cybersecurity is emerging as a major concern for the automotive industry [1], [2]. Numerous remote attack surfaces and a high level of computer-controlled critical systems make security of automotive networks an increasingly complex technical challenge [3], [4]. Many researchers have demonstrated attacks that leverage a car's wireless interfaces to gain access to internal communication buses [5], [6]. With bus level access, an attacker has the ability to control or manipulate critical systems, such as the antilock brakes and cruise control, potentially affecting driver safety [7], [8].","Hristos Giannopoulos,Alexander M. Wyglinski,Joseph Chapman",IEEE Vehicular Technology Magazine,2017
10.1109/vtcfall.2018.8690568,,,Secure Distributed Anonymous Data Collection for Vehicular Ad-Hoc Networks,"In this paper, we propose a VANET architecture capable of securing anonymous data collection from a distributed set of autonomous vehicles. The proposed architecture features a hybrid combination of centralized and decentralized routing concepts. Unlike other VANET implementations, our proposed architecture allows lower latency by having a ad hoc routing option as well as greater availability via the centralized methods. The proposed architecture guarantees user anonymity within the VANET framework. Most VANET models assume most users do not value the privacy of their identity. We assume that each vehicle is equipped with a VANET computer capable of storing data, and that vehicles can communicate directly with each other and exchange data within short distances.","Jabari Stegall,Alexander M. Wyglinski",2018 IEEE 88th Vehicular Technology Conference (VTC-Fall),2018
10.1145/3307772.3328283,,,Mitigating Trust Issues in Electric Vehicle Charging using a Blockchain,"Energy systems are rapidly becoming decentralized due to advances in distributed renewable generation, storage technologies, and electric vehicles (EVs). One consequence of decentralization is the loss of a central trusted party. There is, therefore, a need for a solution that enables interactions between mutually untrusting agents. In this paper, we present a general methodology for blockchain-oriented system design and demonstrate its use to design a system for EV charging in a decentralized network of charging stations. We also show how a blockchain can be integrated with minimal changes to a legacy back end. Our solution is scheduled for roll-out by the EV charging service provider SWTCH in the near future.","Christian Gorenflo,Lukasz Golab,Srinivasan Keshav",e-Energy,2019
10.1109/mits.2018.2889714,,,Intelligent Transportation System Security: Impact-Oriented Risk Assessment of in-Vehicle Networks,"The concept of Intelligent Transportation Systems (ITS) was developed in the 1980s when then upcoming technologies and cognitive information were incorporated into the road infrastructures and vehicles. The ITS infrastructure is critical yet not immune to both physical and cyber threats. Vehicles are cyber-physical systems which are a core component of ITS, can be either a target or a launching point for an attack on the ITS network. Unknown vehicle security vulnerabilities trigger a race among adversaries to exploit the weaknesses and security experts to mitigate the vulnerability. In this study, we identified opportunities for adversaries to take control of the in-vehicle network, which can compromise the safety, privacy, reliability, efficiency, and security of the transportation system. This study contributes in three ways to the literature of ITS security and resiliency. First, we aggregate individual risks that are associated with hacking the in-vehicle network to determine system-level risk. Second, we employ a risk-based model to conduct a qualitative vulnerability-oriented risk assessment. Third, we identify the consequences of hacking the in-vehicle network through a risk-based approach, using an impact-likelihood matrix. The qualitative assessment communicates risk outcomes for policy analysis. The outcome of this study would be of interest and usefulness to policymakers and engineers concerned with the potential vulnerabilities of such critical infrastructures.","Kaveh Bakhsh Kelarestaghi,Mahsa Foruhandeh,Kevin Heaslip,Ryan M. Gerdes",IEEE Intelligent Transportation Systems Magazine,2019
10.23919/jcc.2021.08.021,,,C-V2X equipment identification management and authentication mechanism,"Cellular vehicle-to-everything (C-V2X) is the most promising V2X communication technology which can greatly improve traffic efficiency and road safety. However, when vehicles are interconnected with the surrounding radio environment, the CV2X system will face various network security risks and threats, significantly impacting on traffic and life safety. This paper proposes a novel unified identification management framework and security authentication mechanism for the C-V2X equipment based on the security problems analyses of the C-V2X system and the existing security protection schemes. This paper also presents the security analysis and evaluation for the united identification management and authentication mechanism. A experiment system is implemented to verify feasibility and effectiveness for the proposed mechanism.","Shanzhi Chen,Chen Shanzhi,Qiang Li,Qiang Li,Qiang Li,Wang Yong,Hui Xu,Jia Xiaoyong",China Communications,2021
